Ed Sheeran,Cause I’ve been away for a bit here’s two singles rather than one - Castle On The Hill & Shape Of You https://atlanti.cr/2singles,0,0,5.3M Views,10.175
Ed Sheeran,‪The club isn't the best place to find a lover...‬,0,0,1.8M Views,6.662
Ed Sheeran,When I was six years old I broke my leg...,0,0,1.9M Views,6.615
Ed Sheeran,6th January 5am GMT | midnight ET x,0,0,3.2M Views,10.345
Ed Sheeran,Hello 2017...,0,0,17M Views,9.335
Ed Sheeran,"Only two weeks until my big screen event, we’ll be beaming live from the world premiere to your local cinema. You’ll be able to see coverage of the green carpet, me doing a special one off performance and the extended Jumpers for Goalposts film with unseen footage from my sell out Wembley show. In cinemas Oct 22, gonna be fun get your tickets at edsheeranmovie.com",0,0,506k Views,76.309
Ed Sheeran,Jumpers For Goalposts [Trailer],0,0,421k Views,30.03
Ed Sheeran,"Absolutely loving all your #EdPhotograph submissions guys, keep them coming! 
http://photograph.edsheeran.com",0,0,316k Views,7.04
Ed Sheeran,SAVE. THE. DATE. 9/26 for #GlobalCitizenFestival in NYC. Stay tuned to learn more about this event to end extreme poverty! http://bit.ly/1F6K1AR,0,0,303k Views,20.04
Ed Sheeran,Celebrating International Day of Happiness with MixRadio United Nations #HappySoundsLike has launched! Listen here http://www.happysoundslike.com,0,0,788k Views,22.32
Ed Sheeran,I’m going to be performing at the #MTVEMA in Glasgow! One of the other performers will be announced today at www.mtvema.com,0,0,726k Views,13.6
BuzzFeedVideo,7 Things Crafty People Dominate,137939,71.0,975k Views,70.953
BuzzFeedVideo,Signs You Can’t Commit,313218,103.0,641k Views,100.158
BuzzFeedVideo,Did You Eat My Hot Cheetos?,0,0,595k Views,11.369
BuzzFeedVideo,Celebs Take A Sobriety Test At The Golden Globes,0,0,578k Views,154.579
BuzzFeedVideo,Me as #saltbae,0,0,494k Views,7.274
BuzzFeedVideo,Dating As An Indian Woman,0,0,419k Views,380.35
BuzzFeedVideo,YOU DO YOU.,0,0,1.3M Views,15.367
BuzzFeedVideo,Guys Get The Oil Sucked Out Of Their Pores,0,0,983k Views,99.433
BuzzFeedVideo,Best Of BuzzFeed 2016,0,0,177k Views,177.726
BuzzFeedVideo,Single People Try Bizarre Sex Toys,0,0,605k Views,232.659
BuzzFeedVideo,Here's an easy way to drink more water.,0,0,1.6M Views,31.977
BuzzFeedVideo,Women Try Extreme Pogo Sticking,0,0,467k Views,366.675
BuzzFeedVideo,Can You Guess The Younger Version of These Celebrities?,620923,240.0,491k Views,239.955
BuzzFeedVideo,The Most Satisfying Job In The World,0,0,367k Views,29.651
BuzzFeedVideo,10 Changes You Can Make To Have A Great Year,439303,115.0,410k Views,115.113
BuzzFeedVideo,When Your Doctor Is Hot,458331,77.0,628k Views,74.665
BuzzFeedVideo,$80 Tattoo Vs. $875 Tattoo,0,0,2.7M Views,732.905
BuzzFeedVideo,For Anyone Who Says You Shouldn't Rescue A Dog...,0,0,1.1M Views,61.694
BuzzFeedVideo,"Thanks, Obama. No, seriously. Thank you.",0,0,440k Views,150.995
BuzzFeedVideo,Can You Make Any Food Dessert?,998437,215.0,592k Views,215.187
BuzzFeedVideo,Can you make it through this video without getting hungry?,0,0,12M Views,55.187
BuzzFeedVideo,This Is Perfect For When It's Too Cold To Get Out Of Bed,0,0,5M Views,24.105
BuzzFeedVideo,12-Year-Old Basketball Star Vs. Regular Adults,0,0,341k Views,305.641
BuzzFeedVideo,Do Guys Know What Women Want?,736615,274.0,209k Views,272.066
BuzzFeedVideo,Coming Out,2193954,282.0,2.6M Views,270.91
Jimmy Kimmel Live,Donald Trump Guest Stars on New Celebrity Apprentice,0,0,117k Views,140.186
Jimmy Kimmel Live,92-year-old Leonard takes on 13-year-old Travers in #GenerationGap,0,0,110k Views,554.515
Jimmy Kimmel Live,Jimmy Kimmel Talks to Teenage Shark Bite Victim,35897,379.0,191k Views,375.688
Jimmy Kimmel Live,Jimmy Kimmel Analyzes Corinne from The Bachelor,80396,318.0,191k Views,314.777
Jimmy Kimmel Live,Ben Affleck's Brother Casey Did Not Thank Him in Golden Globes...,950687,236.0,306k Views,232.946
Jimmy Kimmel Live,The Bachelor Nick Viall Awkwardly Reunites with Ex-Girlfriends...,0,0,125k Views,226.189
Jimmy Kimmel Live,Andy Richter on New Celebrity Game Show 'Big Fan',108711,297.0,65k Views,292.672
Jimmy Kimmel Live,Behind the Scenes with Jimmy Kimmel and Audience (Most Positiv...,0,0,75k Views,240.303
Jimmy Kimmel Live,Be a Guest on Jimmy Kimmel Live!,0,0,1.2M Views,112.361
Jimmy Kimmel Live,Kevin Costner's Unbelievable Day with President George H.W. Bush,115675,379.0,256k Views,374.637
Jimmy Kimmel Live,Mel Gibson Cuts Hair & Gets Shaved on Hollywood Blvd,633200,393.0,143k Views,389.552
Jimmy Kimmel Live,Jimmy Kimmel Receives Strange Gift From Guitar Player,24144,93.0,110k Views,89.235
Jimmy Kimmel Live,Jimmy Kimmel's Giant Stuffed Bear Revenge,448059,86.0,343k Views,81.561
Jimmy Kimmel Live,Cousin Sal's Home Deliveries - Thai Food,99551,150.0,78k Views,145.492
Jimmy Kimmel Live,Don't Talk Into the Mic and Win $10,213269,149.0,221k Views,146.326
Jimmy Kimmel Live,Verne Troyer Visits a Wolf Sanctuary,90751,54.0,119k Views,51.281
Jimmy Kimmel Live,Guillermo's New Year's Resolution,0,0,93k Views,67.797
Jimmy Kimmel Live,The Bachelor - Home Alone,0,0,240k Views,62.275
Jimmy Kimmel Live,Kimmel Kartoon - The Bachelor and Jabberjaw,0,0,100k Views,56.202
Jimmy Kimmel Live,"Bachelor Watch Party with Jimmy Kimmel, Andi Dorfman and Kaitl...",0,0,122k Views,111.975
Jimmy Kimmel Live,Jimmy Kimmel's Predictions for The Bachelor Nick Viall,0,0,91k Views,95.141
Jimmy Kimmel Live,"The Bachelor Nick Viall on Getting Dumped, This Season's Conte...",0,0,107k Views,308.871
Jimmy Kimmel Live,Jennifer Aniston’s Bachelor 2017 Picks,0,0,180k Views,221.017
Jimmy Kimmel Live,HANKS Starring Captain Sully Sullenberger,0,0,244k Views,232.574
Jimmy Kimmel Live,Future Jimmy Kimmel for Elbow Magic,0,0,88k Views,121.568
The Tonight Show Starring Jimmy Fallon,"Humannequins with Queen Latifah, Wayne Coyne and Fred Armisen",226110,348.0,1M Views,348.99
The Tonight Show Starring Jimmy Fallon,Golden Globes: Cold Open,0,0,12M Views,295.752
The Tonight Show Starring Jimmy Fallon,Jimmy Fallon's Golden Globe Cold Open Tease,347187,11.0,1.1M Views,11.091
The Tonight Show Starring Jimmy Fallon,"Will It Tea? with Jimmy Fallon, Rhett & Link (Good Mythical Mo...",3016882,557.0,1.1M Views,558.377
The Tonight Show Starring Jimmy Fallon,Jimmy Demos the Hottest Christmas Toys with Kid Experts Evan a...,673089,375.0,915k Views,376.318
The Tonight Show Starring Jimmy Fallon,"Happy Holidays! Tonight Show Web Team here, we're going to try to hatch a Hatchimals!",0,0,897k Views,3044.234
The Tonight Show Starring Jimmy Fallon,Best Friends Challenge with Viola Davis,440847,253.0,623k Views,254.142
The Tonight Show Starring Jimmy Fallon,"Jimmy Fallon, Paul McCartney and ""Sing"" Cast Perform ""Wonderfu...",0,0,8.7M Views,97.619
The Tonight Show Starring Jimmy Fallon,Denzel Washington Dramatically Reads Greeting Cards,2939849,385.0,2.4M Views,386.067
The Tonight Show Starring Jimmy Fallon,Virtual Reality Pictionary with Andrew Rannells and Michael Che,0,0,590k Views,512.642
The Tonight Show Starring Jimmy Fallon,Ramen Challenge with Sienna Miller (Plus Rockettes Surprise),0,0,1.1M Views,247.422
The Tonight Show Starring Jimmy Fallon,Snapchat Interview with Arnold Schwarzenegger,0,0,2.3M Views,188.073
The Tonight Show Starring Jimmy Fallon,Air Guitar Battle with Michael Fassbender,0,0,2.2M Views,274.601
The Tonight Show Starring Jimmy Fallon,Bryan Cranston Plays Cranst-In or Cranst-Out (Holiday Edition),0,0,1.1M Views,121.299
The Tonight Show Starring Jimmy Fallon,Jimmy and Dwayne Johnson Surprise 'Tonight Show' Staffer with ...,0,0,19M Views,228.286
The Tonight Show Starring Jimmy Fallon,Hashtags: #TextFail,0,0,1.6M Views,162.942
The Tonight Show Starring Jimmy Fallon,Jimmy Fallon Debuts the Nintendo Switch,0,0,2.3M Views,581.737
The Tonight Show Starring Jimmy Fallon,Mad Lib Theater with Chris Pratt,0,0,2.9M Views,420.499
The Tonight Show Starring Jimmy Fallon,"Tonight Show Family Feud with Steve Harvey, Annette Bening and...",0,0,1.1M Views,734.377
The Tonight Show Starring Jimmy Fallon,"Charades with Chelsea Handler, John Legend and Chrissy Teigen",0,0,1.8M Views,470.931
The Tonight Show Starring Jimmy Fallon,Singing Whisper Challenge with Emma Stone,0,0,3M Views,402.814
The Tonight Show Starring Jimmy Fallon,Felicity Jones Demos Her Badass Star Wars Fight Moves on Jimmy,0,0,1.2M Views,245.694
The Tonight Show Starring Jimmy Fallon,"Password with Natalie Portman, Neil Diamond and J.J. Abrams",0,0,1.1M Views,463.209
The Tonight Show Starring Jimmy Fallon,Freestylin' with The Roots: Hamilton Glass Balls,0,0,750k Views,461.374
The Tonight Show Starring Jimmy Fallon,Point Pleasant Police Department with Kevin James (Thanksgivin...,0,0,2.4M Views,544.019
Linkin Park,Good times with Phoenix and PGA Pro golfer Brendan Steele.,0,0,274k Views,17.297
Linkin Park,"Congratulations to ZwieR.Z. on winning the November Stagelight #MonthlyMusicContest II presented by Open Labs. Check out his winning Wild Card song ""Wings"" http://bit.ly/2hFlQdB

Don’t forget, there are only two weeks left to submit your original #Rock music in this month's contest. Get your music heard around the world and take a shot at winning over $3,500 in tech gear from Intel and Lenovo United States + a chance at the grand prize - a day in the studio with us.

Not a creator? No problem. Listen, vote and win weekly sweepstakes prizes by signing into the ‪#‎StagelightSweepstakes. Visit http://contest.openlabs.com/contest for full details.",0,0,140k Views,47.123
Linkin Park,Linkin Park x MadeWorn,607595,226.0,192k Views,13.609
Linkin Park,"Linkin Park x MadeWorn. $10 from the sale of each white t-shirt and hoodie, and $100 from the sale of each special edition black t-shirt will benefit Music for Relief. Available for a limited time at http://lprk.co/MadeWorn. #LPxMW",0,0,75k Views,11.701
Linkin Park,Linkin Park x MadeWorn,607595,226.0,192k Views,225.961
Linkin Park,Happy Birthday #LiveInTexas.,0,0,624k Views,43.117
Linkin Park,"Linkin Park - ""Burn It Down"" Mannequin Challenge (2012)",0,0,2.1M Views,29.097
Linkin Park,"Congratulations to Joe Nance on winning the October Stagelight #MonthlyMusicContest II presented by Open Labs. Check out their winning Hip Hop track ""Crazy World"" http://bit.ly/2eUnMc7
Don’t forget, there is only two weeks left to submit your original #wildcard music in this month's contest. Get your music heard around the world and take a shot at winning over $3,500 in tech gear from Intel and Lenovo United States + a chance at the grand prize - a day in the studio with us.
Not a creator? No problem. Listen, vote and win weekly sweepstakes prizes by signing into the ‪#‎StagelightSweepstakes. Visit http://contest.openlabs.com/contest for full details.",0,0,124k Views,43.006
Linkin Park,"Live from the studio: the guys talk about the inspirations of the songs, working with new friends Justin Parker and Eg White, and the brand new LPU 16 package.",0,0,842k Views,2838.001
Linkin Park,"Belgium - we're looking forward to coming back to Rock Werchter on July 1, 2017. It’s our second time headlining this festival - tickets go on sale November 19 at 10am (GMT+1) - http://www.rockwerchter.be #rw17",0,0,256k Views,20.499
Linkin Park,"On June 15th, 2017 we are returning to Poland and headlining Impact Festival 2017 at the Tauron Arena in Kraków. We can't wait to see you. Tickets go on sale starting November 7th at 10 a.m. (CET): lprk.co/impact2017 #LinkinParkPL #ImpactFestival2017 #LiveNationPoland",0,0,207k Views,20.947
Linkin Park,"Sziasztok! We are coming to the city of Sopron on June 27, 2017 and look forward to headlining Telekom VOLT Festival. Tickets on sale November 17 at 4pm (CET): lprk.co/volt2017",0,0,163k Views,18.259
Linkin Park,"We are coming to the city of Sopron in Hungary and look forward to headlining VOLT Fesztivál Official on June 27, 2017. Tickets on sale November 17 at 4pm (CET): lprk.co/volt2017 #volt2017 #voltfestival",0,0,320k Views,18.259
Linkin Park,Studio Moments: Box Boom Smash,0,0,407k Views,17.193
Linkin Park,Happy Birthday #HybridTheory.,0,0,971k Views,9.983
Linkin Park,Studio Moments: Rob Overhead,0,0,219k Views,17.15
Linkin Park,Studio Moments: Bongo Band Jam,85016,57.0,512k Views,56.83
Linkin Park,"Congratulations to MAR CO on winning the September Stagelight #MonthlyMusicContest II presented by Open Labs. Check out their winning electronic track ""No One's"" http://bit.ly/2dhtRyJ

There are only two weeks left to submit your original #hiphop music in this month's contest. Get your music heard around the world and take a shot at winning over $3,500 in tech gear from Intel and Lenovo United States + a chance at the grand prize - a day in the studio with us.

Not a creator? No problem. Listen, vote and win weekly sweepstakes prizes by signing into the ‪#‎StagelightSweepstakes. Visit http://contest.openlabs.com/contest for full details.",0,0,176k Views,43.518
Linkin Park,Studio views.,0,0,266k Views,21.941
Linkin Park,"It’s official, we have a winner for Month 5 - ROCK. Congratulations to That Noise on winning the August Stagelight ‪#‎MonthlyMusicContest II presented by Open Labs. Check out their song ""World on Fire"" http://bit.ly/2cVrWoN

Don’t forget, there are only two weeks left to submit your Electronic music for Month 6. Get your music heard around the world and take a shot at winning over $3,500 in gear from Intel and Lenovo United States + a chance at the grand prize - a day in the studio with us.

Not a creator? No problem. Listen, vote and win weekly sweepstakes prizes by signing into the ‪#‎StagelightSweepstakes. Visit http://contest.openlabs.com/contest for full details.",0,0,178k Views,45.587
Linkin Park,Tracking bass.,0,0,338k Views,4.405
Linkin Park,Chester checks in from the studio.,0,0,812k Views,46.142
Linkin Park,"It’s on us. You and a friend could win a trip to Los Angeles to stop by our headquarters, meet the band, see some of our favorite local spots, and be the host of Music for Relief's #PowertheWorld chat live on Facebook for millions to see! See how you can earn points for supporting at lprk.co/propeller.",0,0,404k Views,30.462
Linkin Park,live from the studio: Brad and Phoenix are losing their minds.,0,0,323k Views,435.256
